{
  "version": "0.29.1",
  "build": 76,
  "tag": "v0.29.1",
  "url": "https://github.com/ImLogueybear/PocketVaultTCG/releases/tag/v0.29.1",
  "notes": "### Changed\r\n- **Runtime data now comes from PKMNDB.** The scanner reads the\r\n  `scan/pocketvault` shards from PKMNDB's R2 bucket, the update checker polls\r\n  `PKMNDB/app-data/updates.json`, matched Japanese cards use PKMNDB R2 artwork,\r\n  and the remaining 39 app-only energy images plus set icons live on the\r\n  `app-data` branch.\r\n- Removed the app's scan-index publisher and `publish-scan-index` workflow;\r\n  PKMNDB owns building/publishing the PocketVault index. `npm run scan-index` is\r\n  now build-only for smoke tests and benchmarks.\r\n- The retired Pages data repository is no longer used by the app at runtime.\r\n\r\n### Notes\r\n- 0.29.0 still polls the old manifest; this release is published to both the\r\n  old manifest and PKMNDB during the transition.\n\n---\n\nDebug build of the PocketVaultTCG Android app (debug-signed). Sideload for testing.\nBuilt locally from 2f70892af2054af03621d29a8b9688778b288fc2.",
  "publishedAt": "2026-10-19T20:35:14.787Z"
}
