{
  "version": "0.2.0",
  "build": 3,
  "tag": "v0.2.0",
  "url": "https://github.com/ImLogueybear/PocketScanTCG/releases/tag/v0.2.0",
  "notes": "Adds a calibration-lab contribution export panel that packages rosette, light, and edge captures into an intake-ready ZIP for local sharing. Rewrites rosette analysis to detrend illumination, detect screen pitch by autocorrelation, and return inconclusive when the capture is too smooth to assess. Raw-card automated readings remain experimental until the physical calibration study is complete.",
  "publishedAt": "2026-10-25T00:00:00Z"
}
