{
  "version": "0.32.0",
  "build": 87,
  "tag": "v0.32.0",
  "url": "https://github.com/ImLogueybear/PocketVaultTCG/releases/tag/v0.32.0",
  "notes": "### Changed\r\n- **Progressive first launch:** seeding now writes English first and makes the\r\n  app usable immediately; Japanese and Chinese finish in the background with a\r\n  small non-blocking status line. Previously all three catalogues (~70k cards)\r\n  blocked the splash screen before first paint.\r\n- **Incremental seeding:** each language is written as an idempotent upsert and\r\n  only its own rows are reconciled afterwards, replacing the clear-and-rebuild\r\n  that emptied the library while it ran. An interrupted language resumes on the\r\n  next launch, and installs upgrading from the previous release adopt their\r\n  existing data instead of rewriting ~70k rows.\r\n- **Search:** prepared keys are built once and reused, and a broad query now\r\n  keeps only the first page in order instead of sorting every match. Worst-case\r\n  query drops from ~17 ms to ~2 ms with identical ordering; searches are also\r\n  now punctuation- and accent-insensitive (\"mrmime\" finds \"Mr. Mime\").\r\n- **Card grid:** long sets are windowed. A 782-card set renders ~44 tiles and\r\n  keeps its full scroll height, instead of mounting all 782.\r\n- **PWA:** the English catalogue is precached, so a first launch installed while\r\n  offline can seed. Japanese/Chinese chunks stay runtime-cached.\r\n- **Scan-index memory:** fingerprints keep the illustration grid in the packed\r\n  int8 form the published shards already use (plus a per-record NCC scale)\r\n  instead of inflating it into a JS number array. The retained index measures\r\n  5,074 → 1,425 bytes/card, about **336 MB → 94 MB** for the 69,439-record\r\n  canonical index. Ranking is numerically unchanged (worst per-reference score\r\n  delta 4.4e-16; a real reference card still self-matches at 1.0000), and the\r\n  on-device fingerprint path now writes the same shape.\r\n- **Data migration:** Dexie v14 clears the derived fingerprints and their\r\n  `scanIndexSha:*` markers so the next launch re-downloads them. Collection,\r\n  wishlist, prices, grades and saved scans are untouched.\r\n- **Graded comps:** PkmnPrices eBay sold comps are now the only source\r\n  (card-scoped by set + number, exact attribution, `lookbackDays` window).\r\n  Removed the eBay/SoldComps integrations and all their settings (eBay Client\r\n  ID/Secret, marketplace, sandbox, SoldComps key/budget), plus active eBay\r\n  listings and the \"Prefer realized eBay sales\" setting — asking prices are not\r\n  evidence of value, and the extra setup only served power users. PriceCharting\r\n  remains a reference.\r\n\r\n### Fixed\r\n- **PkmnPrices October 2026 API changes:** lookups now send the language\r\n  explicitly (English/Japanese) and ask the detail endpoint for USD, so names\r\n  without the old trailing number and the new language gating behave correctly.\r\n  A plan-gated `403` (for example Japanese on a Free key) is reported as a plan\r\n  restriction instead of a rejected key, and a `429` uses the API's\r\n  `error.limit_type`, `Retry-After`, `retry_after`/`resets_at` and\r\n  `upgrade_url` to say which limit was hit and when it clears (per-minute vs\r\n  the daily credit allowance) rather than guessing.\r\n- **PkmnPrices proxy quota headers:** the Worker now forwards and exposes\r\n  `x-credits-*`, `x-rate-*`, `Retry-After` and `Warning`, and never replays\r\n  credit/rate headers from its edge cache (a cache hit costs no credit).\r\n  Settings → PkmnPrices **Test** works without a personal key, bypasses the\r\n  cache, and shows live credits/requests plus any API warning.\r\n- **Japanese PkmnPrices fallback:** the set map only carried pre-migration ids,\r\n  so canonical `ja-pkmndb-*` cards never reached PkmnPrices. Added 338\r\n  name-matched Japanese set ids (plus the legacy aliases), restoring Japanese\r\n  price lookups (verified against Expansion Pack Pikachu).\r\n- **Set/number matching:** card resolution now prefers an exact set name over\r\n  prefix containment, so \"Base Set\" cannot match \"Base Set 2\", and collector\r\n  numbers are compared with leading zeros/`No.` normalized. This prevents a\r\n  price or comp from the wrong set/printing.\r\n\r\nNo descriptor change (`SCAN_VERSION` stays 5) and no PKMNDB change: the\r\npublished `scan/canonical` index is unaffected.\n\n---\n\nDebug build of the PocketVaultTCG Android app (debug-signed). Sideload for testing.\nBuilt locally from 7e78d3a072cdce34c16fbc189f994d47c0029ee4.",
  "publishedAt": "2026-10-28T03:10:11.161Z"
}
